{
  "package_id": "lovefu-hillbed-search-rsa-real-uat-upload-v1-2",
  "source_portfolio_id": "lovefu-hillbed-search-rsa-real-uat-v1-2",
  "brand_name": "LOVEFU大島樂眠",
  "product_name": "山丘樂眠床",
  "campaign_type": "search_rsa",
  "generated_by": "codex",
  "generated_at": "2026-03-16T00:28:26+08:00",
  "delivery_metadata": {
    "delivery_target": "media_buyer",
    "version_label": "real-uat-v1-2-20260315",
    "source_interpretation_id": "lovefu-hillbed-search-rsa-real-uat-v1-2",
    "upstream_confidence": "low",
    "angle_taxonomy_version": "v1.2",
    "sign_off_status": "pending_review"
  },
  "handoff_validation": {
    "portfolio_field_validation_passed": true,
    "validated_sections": [
      "angle_taxonomy",
      "final_asset_pack",
      "replacement_map",
      "coverage_check",
      "portfolio_summary",
      "compliance_notes"
    ]
  },
  "angle_taxonomy": {
    "version": "v1.2",
    "keys": [
      "product_feel",
      "risk_reversal",
      "brand_trust",
      "entry_value",
      "life_scene",
      "concrete_number",
      "pain_point",
      "social_proof",
      "legacy_phrase",
      "cta_lower_friction"
    ]
  },
  "strategic_notes": {
    "main_angles": [
      {
        "angle_key": "product_feel",
        "label": "支撐與包覆感",
        "evidence": "可維持，但若後續要擴寫，先檢查是否已接近冗餘。",
        "recommendation": "維持主力資產，下一輪只做小幅變體。"
      },
      {
        "angle_key": "risk_reversal",
        "label": "試睡與安心承諾",
        "evidence": "可維持，但若後續要擴寫，先檢查是否已接近冗餘。",
        "recommendation": "維持主力資產，下一輪只做小幅變體。"
      },
      {
        "angle_key": "brand_trust",
        "label": "品牌與信任證據",
        "evidence": "可維持，但若後續要擴寫，先檢查是否已接近冗餘。",
        "recommendation": "維持主力資產，下一輪只做小幅變體。"
      },
      {
        "angle_key": "social_proof",
        "label": "評價背書",
        "evidence": "可維持，但若後續要擴寫，先檢查是否已接近冗餘。",
        "recommendation": "維持主力資產，下一輪只做小幅變體。"
      }
    ],
    "test_angles": [
      {
        "angle_key": "pain_point",
        "label": "腰背壓力切入",
        "evidence": "只有測試位承接，先觀察再決定是否升主力。",
        "recommendation": "保留測試位，回看是否值得升主力。"
      },
      {
        "angle_key": "life_scene",
        "label": "生活情境",
        "evidence": "主力已承接，測試位可再驗證變體。",
        "recommendation": "保留測試位，回看是否值得升主力。"
      },
      {
        "angle_key": "cta_lower_friction",
        "label": "低摩擦 CTA",
        "evidence": "可維持，但若後續要擴寫，先檢查是否已接近冗餘。",
        "recommendation": "保留測試位，回看是否值得升主力。"
      }
    ],
    "do_not_expand_angles": [
      {
        "angle_key": "brand_trust",
        "label": "品牌與信任證據",
        "evidence": "真實來源中泛 LOVEFU / 飄雲 trust 句過多，若再擴寫會放大產品焦點漂移。",
        "recommendation": "除非新增更明確的山丘產品證據，否則不再擴充 generic trust copy。"
      },
      {
        "angle_key": "legacy_phrase",
        "label": "產品名承接",
        "evidence": "本輪只有 hl-12 承接產品名 coverage，該 angle 只作 coverage carrier，不該再往外擴。",
        "recommendation": "維持單一 carrier 即可，不要把產品名 angle 擴成空泛 copy 池。"
      }
    ],
    "safer_rewrite_watchlist": [
      {
        "source_asset_id": "hl-03",
        "source_text": "不再背痛失眠－LOVEFU山丘樂眠床",
        "reason": "歷史 proxy 高，但原句屬高風險結果承諾。",
        "recommended_candidate_id": "cand-h01",
        "recommended_text": "睡醒少點負擔，LOVEFU山丘樂眠床"
      },
      {
        "source_asset_id": "desc-01",
        "source_text": "腰椎不再酸痛，只要躺上它就足夠，2 次加熱的中鋼獨立筒彈簧，搭配獨家泡棉，創造飄雲Ｑ彈躺感。",
        "reason": "高 proxy，但直接承諾酸痛改善。",
        "recommended_candidate_id": "cand-d01",
        "recommended_text": "躺下先被穩穩接住，中鋼獨立筒搭配獨家泡棉，讓腰背壓力少一點。"
      },
      {
        "source_asset_id": "desc-03",
        "source_text": "LOVEFU 飄雲專利床墊，98% 好評推薦，舒適支撐幫助緩解腰痛，讓您享受無壓樂眠。",
        "reason": "高評價與舒適感可保留，但不應直接承諾緩解腰痛。",
        "recommended_candidate_id": "cand-d02",
        "recommended_text": "LOVEFU飄雲專利床墊，以穩定支撐搭配柔軟包覆，延續高評價的無壓睡感。"
      },
      {
        "source_asset_id": "desc-22",
        "source_text": "LOVEFU 山丘樂眠床，專為腰痛患者設計，提供強力支撐與舒適包覆，帶來每晚好眠。",
        "reason": "山丘產品句應該保留，但患者導向承諾過於高風險。",
        "recommended_candidate_id": "cand-d03",
        "recommended_text": "LOVEFU山丘樂眠床，以穩定支撐搭配舒適包覆，讓久坐後的腰背更容易放鬆。"
      }
    ]
  },
  "upload_ready_assets": {
    "primary_pack": {
      "headlines": [
        {
          "asset_id": "hl-01",
          "text": "200kg 不塌陷，最好睡的撐腰床墊",
          "char_count": 18,
          "char_pass": true,
          "source": "retained",
          "angle_key": "concrete_number",
          "performance_tier": "top",
          "decision_confidence": "directional",
          "observe_subtype": null,
          "risk_level": null,
          "rewrite_mode": null,
          "is_protected_phrase_carrier": false,
          "coverage_tags": {
            "protected_phrases": [],
            "must_include_tokens": [],
            "reusable_motifs": [
              "concrete-number",
              "pain-point-solution"
            ]
          }
        },
        {
          "asset_id": "hl-02",
          "text": "大島樂眠 LOVEFU 飄雲專利床墊",
          "char_count": 18,
          "char_pass": true,
          "source": "retained",
          "angle_key": "brand_trust",
          "performance_tier": "top",
          "decision_confidence": "directional",
          "observe_subtype": null,
          "risk_level": null,
          "rewrite_mode": null,
          "is_protected_phrase_carrier": false,
          "coverage_tags": {
            "protected_phrases": [],
            "must_include_tokens": [
              "LOVEFU",
              "飄雲專利"
            ],
            "reusable_motifs": [
              "trust-proof"
            ]
          }
        },
        {
          "asset_id": "hl-06",
          "text": "100 天安心睡計畫，改善睡眠品質",
          "char_count": 17,
          "char_pass": true,
          "source": "retained_protected_phrase",
          "angle_key": "risk_reversal",
          "performance_tier": "top",
          "decision_confidence": "directional",
          "observe_subtype": null,
          "risk_level": null,
          "rewrite_mode": null,
          "is_protected_phrase_carrier": true,
          "coverage_tags": {
            "protected_phrases": [
              "100天安心睡"
            ],
            "must_include_tokens": [],
            "reusable_motifs": [
              "lower-friction-cta"
            ]
          }
        },
        {
          "asset_id": "hl-07",
          "text": "專為台灣人的睡眠需求設計",
          "char_count": 12,
          "char_pass": true,
          "source": "retained",
          "angle_key": "brand_trust",
          "performance_tier": "top",
          "decision_confidence": "directional",
          "observe_subtype": null,
          "risk_level": null,
          "rewrite_mode": null,
          "is_protected_phrase_carrier": false,
          "coverage_tags": {
            "protected_phrases": [],
            "must_include_tokens": [],
            "reusable_motifs": []
          }
        },
        {
          "asset_id": "hl-09",
          "text": "LOVEFU 飄雲床墊，樂眠好評如潮",
          "char_count": 18,
          "char_pass": true,
          "source": "retained",
          "angle_key": "social_proof",
          "performance_tier": "top",
          "decision_confidence": "directional",
          "observe_subtype": null,
          "risk_level": null,
          "rewrite_mode": null,
          "is_protected_phrase_carrier": false,
          "coverage_tags": {
            "protected_phrases": [],
            "must_include_tokens": [
              "LOVEFU"
            ],
            "reusable_motifs": [
              "trust-proof"
            ]
          }
        },
        {
          "asset_id": "hl-11",
          "text": "指定配送日，LOVEFU 配送超方便",
          "char_count": 18,
          "char_pass": true,
          "source": "retained",
          "angle_key": "cta_lower_friction",
          "performance_tier": "top",
          "decision_confidence": "directional",
          "observe_subtype": null,
          "risk_level": null,
          "rewrite_mode": null,
          "is_protected_phrase_carrier": false,
          "coverage_tags": {
            "protected_phrases": [],
            "must_include_tokens": [
              "LOVEFU"
            ],
            "reusable_motifs": [
              "lower-friction-cta",
              "trust-proof"
            ]
          }
        },
        {
          "asset_id": "hl-12",
          "text": "2026 護脊床墊推薦 - 山丘樂眠床",
          "char_count": 19,
          "char_pass": true,
          "source": "retained",
          "angle_key": "legacy_phrase",
          "performance_tier": "top",
          "decision_confidence": "directional",
          "observe_subtype": null,
          "risk_level": null,
          "rewrite_mode": null,
          "is_protected_phrase_carrier": false,
          "coverage_tags": {
            "protected_phrases": [],
            "must_include_tokens": [
              "山丘樂眠床"
            ],
            "reusable_motifs": [
              "concrete-number",
              "trust-proof"
            ]
          }
        },
        {
          "asset_id": "hl-39",
          "text": "山丘樂眠床 第2張床 擁有支撐腰背與放鬆的魔法",
          "char_count": 23,
          "char_pass": true,
          "source": "retained_observe",
          "angle_key": "life_scene",
          "performance_tier": "borderline",
          "decision_confidence": "directional",
          "observe_subtype": "observe_borderline",
          "risk_level": null,
          "rewrite_mode": null,
          "is_protected_phrase_carrier": false,
          "coverage_tags": {
            "protected_phrases": [],
            "must_include_tokens": [
              "山丘樂眠床"
            ],
            "reusable_motifs": [
              "pain-point-solution",
              "support-feel"
            ]
          },
          "status_note": "以 observe_borderline 身分保留，下一輪若 proxy 仍未上升則移出。"
        },
        {
          "asset_id": "cand-h03",
          "text": "LOVEFU山丘樂眠床，支撐包覆更到位",
          "char_count": 19,
          "char_pass": true,
          "source": "replacement",
          "angle_key": "product_feel",
          "performance_tier": "new",